DATASET/rfmseg.csv

rfm_seg,customer,percentage_value
Active_Custmer,296,6.77%
Churned_Custmer,422,9.65%
Lost_Custmer,267,6.11%
Loyal_Custmer,328,7.50%
Others,2164,49.50%
Potential_Custmer,500,11.44%
Slepping_Away,395,9.03%

README.md

# SQL-RFM-CUSTOMER-SEGMENTATION

Customer Segment	Customer Count	Percentage	Business Insight
Others	2,164	or 49.50%	This is the largest group. Almost half of the customers are not clearly classified into the main segments. This group needs deeper analysis.
Potential_Customer	500 or	11.44%	These customers have future value. With proper offers and engagement, they can become active or loyal customers.
Churned_Customer	422	or 9.65%	These customers show weak recent activity and may have stopped purchasing. They need win-back campaigns.
Sleeping_Away	395	or 9.03%	These customers are not fully lost yet, but their purchasing activity is decreasing. They need quick reactivation.
Loyal_Customer	328	or 7.50%	These customers are valuable because they show strong purchase behavior. They should be retained with loyalty benefits.
Active_Customer	296	or 6.77%	These customers are currently engaged. The business can target them for upselling and cross-selling.
Lost_Customer	267 or	6.11%	These customers are likely inactive for a long time. The company should use low-cost remarketing or special win-back offers.

The largest customer segment is Others, representing 49.50% of total customers. This means many customers do not fall into the main predefined RFM groups. This segment should be studied further and divided into more specific groups in future analysis.

Potential customers represent 11.44% of the customer base. This is an important opportunity for the business because these customers can become active or loyal customers with the right marketing strategy.

Churned customers represent 9.65% of total customers. This shows that a noticeable portion of customers may have already stopped purchasing.

Sleeping Away customers represent 9.03%. These customers are at risk but may still be easier to recover than fully lost customers.

Lost customers represent 6.11%. These customers may be difficult to recover, so the business should not spend too much marketing budget on them unless they had high past value.

Loyal customers represent 7.50%. This group is small but highly important because loyal customers usually generate repeated revenue.

Active customers represent 6.77%. These customers are currently engaged and should be targeted before they become inactive.

The Others segment is very large at 49.50%. This means the current segmentation logic can be improved further.